Id,ProductId,UserId,ProfileName,HelpfulnessNumerator,HelpfulnessDenominator,Score,Time,Summary,Text
353432,B000UVBYRM,A286RI97J5HV6N,Heidi,0,0,5,1308355200,Tastes like a Kit Kat,"These bars are so good. I don't like most protein bars because of the strong protein taste. I do taste a little bit of the protein still cause there is a lot of protein, but mainly I taste peanut butter and crunchy-ness. The chocolate bars, to me, taste like a Kit Kat w a little peanut butter.<br />I love these bars! I think they are worth the try."
353436,B000UVBYRM,AXLWYATME4LVK,S. Wild,0,0,5,1302480000,Wow these are good!,"I have tried LOTS of different protein bars. I don't eat those with high sugar alcohol levels and try to find items with as few unnatural ingredients as possible.<br /><br />These have a few ingredients I am not super crazy about, but wow are they good! Easy to take along and really tastes like you are splurging on a candy bar!<br /><br />I would highly recommend."
353447,B000UVBYRM,AMPVDI3VK4W46,Sarah M. Walsh,0,0,5,1279843200,can't eat anything else now,this is the best protein bar i have ever had.  I tend to eat on the go and I have had one for breakfast almost every weekday day for the past 5 months! A little high in sat fat but it's worth it.
353452,B000UVBYRM,ATY98R7TB1NNG,E. Bretton,0,0,5,1253750400,Greatest tasting protein bar ever!,"having tried multiple (dry, tasteless)bars this is THE BEST!(Although I haven't tried more that two of their flavors)."
353454,B000UVBYRM,A2XCLFJN9HJBAZ,Muriel F,0,0,5,1249862400,Some of the best tasting protein bars I've had..,I love these bars. What more can I say? They contain less sugar than a lot of other bars and still taste pretty good.
353456,B000UVBYRM,A2CTIAQMDM6LDP,Jeff,0,0,5,1245456000,A healthy alternative,"I have a terrible sweet tooth, and these are a great alternative to cookies or cake. Losing weight has been easier with these."
353460,B000UVBYRM,APQW7SKEMU355,Terry R. Schonwald,0,0,5,1224633600,They love them,My husband and our grown son both love the Power Crunch Peanut Butter Creme Bars.
353504,B000UVBYRM,A20T9KCZ7ZY09O,MJLPAA,1,1,5,1331769600,Perfect protein snack,These protein bars are a perfectly healthy treat.  I love that I don't have to feel guilty when I grab one of these.  These fit right into the Metabolic Effect Diet.
353505,B000UVBYRM,A2GXNF3QRHD2Q0,mansgoh,1,1,5,1322870400,favorite bar,the peanut butter bar is probably the best tasting bar that i've had til this day. i crave it everyday!
353510,B000UVBYRM,A24KY9WFCLKZDZ,Kim Kaaz,1,1,5,1304208000,Great taste,I really like all the power bars flavors.  Great for when you want a snack but don't want all the bad stuff that comes with other protein bars.  I also like the crunch. when I'm craving chocolate it really hits the spot and dulls my cravings.
353532,B000UVBYRM,A3NF0H730HCE0W,"Deanna in Cali ""DJ""",0,0,5,1344816000,"It's like a cookie . . . with protein!  Yum, yum, yum.","I stumbled upon these quite by accident: a co-worker left them in the kitchen (people often bring in leftovers or things to share).  I read the package and mused ""Creme filled wafer bar?  Intriguing.""  I'd never heard the words ""wafer"" and ""protein"" used in the same sentence.  But I remembered how much I used to love going to my grandma's house as a kid because she used to keep vanilla, chocolate and strawberry wafer cookies in the cookie jar.<br /><br />These tasty, light crunchy wafers do remind me of those wafer cookies from my childhood.  The peanut butter ones are sweetened with fructose and stevia.  Stevia is a natural swetener with a sightly unusual taste that might be jarring if you're not used it.  It's sweet, but doesn't taste quite like sugar, which is what I like about it.  These bars are just sweet enough to be enjoyable, but not sweet enough that I would want to devour a whole box of them like I would a candy bar.<br /><br />They are light and crispy, and perfect as a snack or a treat.  They're only 10 grams of carbs and 5 grams of sugar [just over a teaspoon] - perfect if you're watching your carbs and want a sweet[ish] snack.  I brought the chocolate one with me to the movies the other night, and while other people had their candy, I had my own ""candy"" to enjoy, without the suagr high and with the benefit of 13 g of portein.  I can't see a big, buff muscley guy getting a lot out of them [men need more calories & protein], but for me, they are the perfect addition to my health and fitness plan.<br /><br />The only thing I'd change [for nutritional purposes] would be to add more fiber.  But I suppose adding that would affect the texture and possibly the taste."
353536,B000UVBYRM,A1WUNGH7CHXY1V,Dfu,0,0,5,1340236800,love this protein bar,Have used this regularly for a few months now. Like that it is wafer and not too heavy. Also not too sweet. Will cont t order through amazon
353540,B000UVBYRM,A2C2I3VM7FT4PQ,barby153,0,0,5,1338768000,Sooo Good!,"Love the flavor, for the calories, low carb & great protein these are so good & convenient!  My only objection is that I can't eat more of them!"
353541,B000UVBYRM,A26LCS1BBLKY9F,BlackHawk,0,0,5,1338681600,"Great snack, like eating a treat!",These are some of the best tasting protein bars I've ever had.  they're like eating a snack but they've also got a good amount of protein in there.  Power Crunch bars are my new favorite; I highly recommend you try them; I've had all of the flavors and not one of them was bad.  What's the best one to try?  If you like Peanutbutter then try that first - but I will say I usually don't like Vanilla flavored anything but even the Vanilla is very tasty and good.
353544,B000UVBYRM,A27X750TSCLBD,"Natasha Fletcher ""Earth Worm""",0,0,5,1337126400,Yum yum,"I just love these bars,they are so good!  The texture is amazing,very good for a health bar.  The bar really took care of my craving for sweets."
353549,B000UVBYRM,AWK9FN7KKWCK9,Dawn DeVane,0,0,5,1333929600,WONDERFUL,"This product is great!!!!!<br />Tastes great, good source of protein!<br />It doesn't tastes like most power bars- either chalky or have a yuck taste to them.<br />It's like a regular cookie..."
353564,B000UVBYRM,A2QM83C1ZCI0EM,ConSumEr,0,0,4,1320796800,Good Protein Bar,"These are pretty good bars.  I like that they don't have 30 grams of protein, so I can actually finish a whole one without feeling lethargic.  They are low carb, which is kind of what I wanted...but I don't enjoy the artificial sweetener in it.  I would honestly rather not have it sweet, but I'm sure most people won't find this an issue."
353567,B000UVBYRM,A4KL48QITDQ28,"janc ""janc""",0,0,5,1318809600,Great taste,These energy bars taste great and come in a variety of flavors. They are low in carbs which is what I need.
354337,B0098QPNJA,A1Z54EM24Y40LL,c2,0,0,5,1350259200,SO awesome!,"I bought these for baseball camp this summer and we ate these things while traveling to Cincinnati and back for a week!  Golly, are they good!  They are a wafer, like those kind that have the creme in the middle, chocolate though, covered in dark mint chocolate.  SO good and they even unmelt quickly when held in front of the car's air conditioner blower!  Ahh, sugar.  The mother of invention!  They're not overpowering in the mint category either. Just a very light cookie, two separate pieces that you can share (oh yeah, like THAT's going to happen!).  Just bought 4 more today - that's how fast they disappear in this house. Highly recommend!"
355280,B004KPMWLG,A1Z54EM24Y40LL,c2,1,1,5,1338249600,Just awesome!,"This stuff, when thoroughly chilled, tastes like those mixed teas you get in restaurants!  Oh is it ever marvelous!  I think it took me less than a minute to consume the entire thing one day while grocery shopping.  This 95 degree heat here in Ohio just takes it out of you rather quickly and although my British girlfriend objects, this is just about the best tea I've ever had!  Grab a TON of this - it's really that good! Highly recommend!"
358045,B0032CJPOK,A2NJAE2OHSSFA7,flows42,0,0,5,1351209600,Best formula on the market,"I have tried pretty much every formula on the market, from similac to enfamil, and this is by far the best.  It settles well with my baby's tummy and she doesn't have any digestive problems.  It's worth the extra money."
360601,B001E6EJTW,A1Z54EM24Y40LL,c2,1,1,5,1203120000,LOVE these!,"I buy so many of these crackers a year the company should give me free stock!  I use these in recipes that call for regular saltines and it just gives the recipes that extra ""punch"" that they would not otherwise have.  The butter in them just adds an extra moistness but they're also awesome as a dip cracker.  Plus, they add a little extra flavor when crushed up into soups.  They do have a tendency to get stale quicker than others though but I guess that's why they make Ziploc bags! Highly recommend!"
361308,B0008JEZ8G,A20EEWWSFMZ1PN,"bernie ""webviator""",0,0,5,1334707200,Great coffee price plus shipping makes it prohibited,When I was working for AAFES I came across this in the Base Exchange. Later I joined the reserves and lived on this stuff. I had withdrawal symptoms when my reserve time came to an end. There is just no substitution. Soon I was able to locate a source on line that costs about half of the Amazon price and shipping combination. Either the price or the shipping is reasonable but combined is ridicules.  I'll keep an eye on the Amazon resellers to see if one day they will come to their senses and I will not have to buy for a third party externally.
361765,B006N3HZ6K,A1BJHZE41QWBX6,"Sharon Pipke ""Sharon""",0,0,5,1349568000,Coffee People Jet Fuel Dark Roast K-Cup Portion Pack for Keurig Brewers (Pack of 50),I received the K-cup coffee on time. I only drink this coffee in the morning to wake me up. The love the flavor of this coffee.
362686,B003JA5KKS,A1Z54EM24Y40LL,c2,0,0,4,1350345600,"Not the best, but CERTAINLY, not the worst!","This is a breakfast blend coffee and, for many coffee producers, a breakfast blend also means ""the strongest daggone brew we can make"" mentality.  Well, caffeine is caffeine and this guy is a bit strong for me.  I prefer Caribou's breakfast blend over this Green Mountain version. It's just entirely more smooth, no bitterness at all, and just a very enjoyable cup of coffee.  I think this one tastes a bit burnt, like Starbuck's, not at all as nice as some of their other blends (especially the pumpkin spice - awesome!).  Try it to see if it suits your taste but get the 12-pack first.  Otherwise, if you think the way I do, 24 of these guys is a LOT of coffee to wash down!"
362687,B003JA5KKS,A1KPKQZ1GMKAKO,Norma,0,0,5,1350345600,Great Coffee,"When I bought my coffeemaker, tried out several different brands and types of coffee but this one has become a stable.  I can count on it for a great cup of coffee - not too strong or too mild, just the way I like it.  Unfortuantely, I now drink more coffee than I probably should because of the taste but that's the only downside."
362688,B003JA5KKS,ALEABNMSVO1JI,gibble,0,0,5,1350172800,awesome coffee,"I have enjoyed this brand of coffee for several years now and it has been consistent in flavor!  I was happy to see that it came in a 50-count box....with cold weather approaching, I will be drinking a LOT more coffee."
362689,B003JA5KKS,A2AAA0U5QD5TGB,DVDLOVER,0,0,5,1350086400,Great buy for K-Cups,"If you love your Keurig coffee brewer, you'll love this buy for Green Mountain 50-count Breakfast Blend Coffee K-Cups. GREAT!!!"
362690,B003JA5KKS,A2WK0Q0WABVVH,bowtie55,0,0,3,1350086400,not to crazy,"Love green mountain coffee, but the breakfast blend was not strong or bold enough for me, will try stronger and bolder ones and get back to you all with another review, thanks"
362691,B003JA5KKS,A1N58XGILUVX6S,Martin B. Kerschus,0,0,3,1350000000,Too weak,I expected a little more flavor as I usually like Green Mountain Coffees.<br />Next time I'll look for a French Roast!
362692,B003JA5KKS,A1B3SY3J47EXZE,Terry Defosse,0,0,5,1349827200,50 count Green Mountain Breakfast Blend K-Cups,"I recently purchased the 50 count Green Mountain Breakfast Blend and I have to say that the price was unbeatable, Not to mention the coffee. I only drink Green Mountain Coffee. I only wish they could offer more variety in the 50 count. I will and am going to continue buying this brand of coffee.Love it- Love it- Love it<br /><br />  Thank You Green Mountain Coffee"
362693,B003JA5KKS,A2SNPFTCYI60V2,D. Bright,0,0,2,1349827200,Not my favorite coffee.,"Seems very weak.  I must be honest, I ordered the wrong coffee.  I was sad. This isn't bad as a base for an iced coffee."
362694,B003JA5KKS,AN71KYKFED796,Lesley V.,0,0,5,1349740800,Green Mountain coffee,Such a great product! Delivered fast & fresh. Can always rely in Green Mountain & kcups are great for people on the go & want 1 cup.
362695,B003JA5KKS,A1BJHZE41QWBX6,"Sharon Pipke ""Sharon""",0,0,5,1349568000,"Green mountain Coffee, Breastfast Blend K-cup Portion Pack for Keurig Brewers, 50 Ct.","I received the order in time. I love the blend of coffee, I use the Keurig machine every day.This is a decafe coffee, I also use regular blend."
363082,B000MXJR72,AXLWYATME4LVK,S. Wild,0,0,5,1295308800,Great!,My Grandson has problems with constipation and this product works great. We give him some every other day and he has no problems! Quick shipping.
365402,B000CQG89Y,A1Z54EM24Y40LL,c2,0,0,5,1306108800,Been drinking it for years!,"I discovered this tea at work one day and have been drinking it for the past 25 years!  It's just awesome - you don't even need sugar - just some hot water and voila! Instant licorice flavor.  If you're not familiar with Stash's teas, then be sure to give this one a try.  They have wonderful, rich flavored teas, not too strong or too weak.  They come in a zillion varieties and all just equally as good.  Sign up for auto delivery on this one - you'll be back for more.  Highly recommend!"
373135,B000084EJY,A1Z54EM24Y40LL,c2,0,0,4,1090972800,Not too bad!,"Again, this is one of those varieties that you use as a &quot;variety&quot; from your cat's regular likes. I toss this one in whenver I can find it in the store and my cat just eats it like well, I have to eat this, don't I? It's not his favorite but he does choke it down somehow. He doesn't leave this one so he likes it somewhat. It's ground, so that isn't his favorite but you can actually see vegetables in this one. I like that part so that's why I buy it."
373141,B000084EJS,A1Z54EM24Y40LL,c2,0,0,4,1090972800,Ground variety - not my cat's favorite,"If your cat loves poultry and ground food, this is a great one.  My previous cat loved this stuff, but my current cat just doesn't like the ground variety as well.  He prefers the food with chunks and gobbles it right up.  I've bought tons of this food over the years and many of my cats just loved it.  It just depends on your cat - if you have one that likes ground, give this one a try!"
373165,B000084EJQ,A1Z54EM24Y40LL,c2,0,0,4,1090972800,What's in this? Great food though,"I wish I knew what was really in this variety. It doesn't say much on the can.  I toss this one in for a little variety, but it's not his favorite.  He loves the carved versions the best, but he tolerates this one as one of those I use for a little change of pace for my cat.  He appreciates it some, I think, but seldom eats the entire can.  But I really would like to know what it consists of so I know what he's eating.  The gravy sure looks nice and the pieces are a nice size as well - not too big so he can get it into his small mouth."
373515,B000V1QYF8,A1Z54EM24Y40LL,c2,1,1,5,1249603200,Top favorite in this house!,"This variety is literally inhaled by one of my cats.  He just cannot wait to get to it - he can even smell it through the can.  He just starts circling and yelling as soon as he sees me grab a can of this stuff.  Pretty funny how much he loves it - it doesn't stink up the kitchen either and the nutritional value is quite high, considering that this is a gourmet cat food. Highly, highly recommend!"
374307,B00004CI84,A20EEWWSFMZ1PN,"bernie ""webviator""",0,0,5,1226016000,"Beetlejuice, Beetlejuice, Beetlejuice!","Adam and Barbara Maitland (Alec Baldwin and Geena Davis) are staying home for their vacation. In an effort to avoid driving over a cute loose mutt, they, car and all plunge over a bridge. The next thing they know is that they are home. However, something is a tad strange. Yep soon, they find they are the recently deceased.  How will they cope with the situation and where can they find help whim strange people purchase and intend to occupy the house?<br /><br />The story takes some intriguing turns. Moreover, the music instead of being a background mood helper is actually as important as the other characters in the story. ""Day-o, he say day-ay-ay-o.""<br /><br />This film is an excellent candidate for Blu-ray. The Blu-ray version also has the standard extras. I am not sure but I could swear there are more scenes than I saw in earlier versions.<br /><br /><a href=""http://www.amazon.com/gp/product/B001B504LI"">The Uninvited</a>"
374335,B00004CI84,A3L5V40F14R2GP,AARON,0,0,4,1004054400,Beetlejuice! Beetlejuice! Beatlejuice!,"Winona Ryder is HOT! HOT! HOT! as the gothic death-rock princess of Doom (see &quot;Lucas&quot; for more W.R. action) The best performance from that eldest Baldwin brother that I've ever seen from any of them.His zenith I'm sure. BEST PERFORMANCE - goes to - Miss Ryder!,of course, I'm a BIG fan, you see? FAV PART - when Beetlejuice was chumming up to Baldwin's character while wearing the same type clothes. No big deal, just witty and clever charm with spit. and when Beetlejuice hits up on Gina Davis and/or Winona Ryder"
374346,B00004CI84,A2C5VLIJMDPWHI,"Shamontiel L. Vaughn ""I'm boycotting Amazon's...",1,2,5,1309305600,Will probably never get tired of this movie,"I've watched this movie so many times I know the dinner table dance routine. Somebody linked it on Facebook, and it made me want to watch the movie again so I did--haven't seen it in years, and I'm surprised I still know the routine. Michael Keaton does a great job as the oh-so-disgusting Beetlejuice, and the rest of the cast plays their roles just as well. The film's plot is just plain weird, but they pulled it off. Couple gets into car accident, dies, tries to figure out how to still live in their house while being dead, and a new family moves in. Should they haunt them? Should they be seen? How do both families coexist, especially with the daughter (Winona Ryder) able to see the ghosts who thought they were in the clear? And why is Beetlejuice always there to crash the party? The movie had a quick pace, funny dialogue and plenty of memorable visuals."
374354,B00004CI84,A32207GKRIJYDI,Tim Chapin,1,2,5,1079222400,I can't believe this is Michael Keaton!!!,"Beetlejuice is truly a work of art!<br />A bit funny, a bit creepy...simply a masterpiece with a great soundtrack to go with.<br />Tim Burton truly knows how to take you to another world.<br />Great casting as well...nothing could be better about this DVD movie!"
374384,B00004CI84,A1ODDK3N8XC7UP,Tommy Evans,1,3,5,1327968000,Classic,I bought the movie because I remember enjoying it as a kid. it did not disappoint. The story and look of the film holds up well.
376296,B000MXHQS4,AXLWYATME4LVK,S. Wild,0,0,5,1295308800,Great!,My Grandson has problems with constipation and this product works great. We give him some every other day and he has no problems! Quick shipping.
378130,B008FHUGNQ,A1BJHZE41QWBX6,"Sharon Pipke ""Sharon""",0,0,5,1349568000,Coffee People Jet Fuel Dark Roast K-Cup Portion Pack for Keurig Brewers (Pack of 50),I received the K-cup coffee on time. I only drink this coffee in the morning to wake me up. The love the flavor of this coffee.
378978,B005ZBZLPI,A1BJHZE41QWBX6,"Sharon Pipke ""Sharon""",0,0,5,1349568000,"San Francisco Bay Coffee Decaf One Cup for Keurig Brewers, French roast, 36 count",I received the order on time. I love the flavor of the French Roast blend. I use my Keurig everyday when I only want one cup of fresh coffee.
380008,B0012KIBCQ,A1Z54EM24Y40LL,c2,0,0,4,1249171200,"Not the favorite, but passable","Of all the gormet Fancy Feast varieties, this one seems to be the least favorite.  Not sure why - they won't eat salmon fresh from the market either.  Must not be on the regular cat's palate for some reason.  The smell is quite nice though - smells like people food really.  You can't really go wrong with these Fancy Feast varieties - they're the hit in this house!"
380704,B00376301U,A1Z54EM24Y40LL,c2,3,4,4,1300838400,"Not bad, but a little pricey","After reading some reviews here that reflect the price of cat food in other states, I feel less likely to complain that they were just raised to $.50 a can!  My cat really likes two of the three flavors in this pack, particularly the beef and salmon.  He's a toothless wonder and they fillets sometimes give him a bit of trouble in the chewing department, but he loves the flavor so much he just swallows most of it whole.  They contain a good deal of gravy too which he loves, but again, the hunks of meat are larger in the fillet variety so if you have a toothless wonder like mine, you might want to keep that in mind.  This is pretty pricey here too - paid about six dollars for this same package here locally.  Great stuff, highly recommend!"
382319,B001STPJJO,A1Z54EM24Y40LL,c2,1,1,5,1287619200,"Great stuff, price pretty good!","I normally buy this loaf pack at my local store that starts with a t at pretty close to this same price.  This makes them .50 a can, which is about average for Fancy Feast.  This is the ground variety, in case you're wondering.  Thought I'd let you know since I didn't see that in the listing.  I have one cat that will eat ground, and one that won't.  Usually the males LOVE their meat so they won't touch ground, but the females will.  They particularly love the chicken in this pack, with turkey running a close second.  Beef I only feed them once a week or so - not their favorite but they'll choke it down.  Great buy, love the free shipping too.  Highly recommend!"
383701,B00451WLYI,A20EEWWSFMZ1PN,"bernie ""webviator""",3,3,5,1342828800,Take a sharp object to defend your self,"Unlike most people, I prefer not a weak coffee but a milder roast than the burnt stuff most coffee houses make that requires many accoutrements to mask like cream, sugar and artificial flavors. Therefore, I purposely only tried the Columbian.<br /><br />I work in a place that has poorly serviced coffee ""dispensing machines."" They are fun in that you never know what will come out in a day-to-day basis. Some time just your coins back. A few people have illicit electric coffee pots, others use a French press, and still others sneak out for the real thing.<br /><br />Now that I discovered the Columbian Via. I have to defend my cup from all those noses that circle my cup. I know there are directions on the pack; however, I now have my own ritual. Clean cup, fill 2/3rds filtered water. 90 seconds in the microwave. Shake contents to bottom of pack. Rip the whole top off the pack with teeth. Pour pack in coup and watch sizzle. Stir for a few seconds. Add a tad of ice. Hope I can make it back to my desk before the cup empties.<br /><br />I was never a fan of reconstituted coffee however I think it is the addition of the micro-ground coffee that adds the edge necessary.<br /><br />In any event you owe it to yourself to try it."
386524,B000I2T9BG,A1Z54EM24Y40LL,c2,0,0,2,1249430400,Picky turkey junky cat turned it down.,"I was surprised when my turkey junky turned this one down.  He's loved most of the other varieties in this series and well, this one just didn't make the grade.  Had to flush it down the garbage disposal so the rest went back to the store for the egg souffles'.  Gotta love that finicky part, huh?  Anyway, I do recommend it anyway because of their high nutritional value.  My rescue Persian cannot eat these shredded varieties because her previous owner kicked out her teeth on one side of her mouth.  She doesn't care much for turkey anyway but I was disappointed that she couldn't chew these because of their high nutritional value.  Gets tiring cutting up all that cat food! Recommend but with the above experience."
391505,B0001RT5OY,A1Z54EM24Y40LL,c2,4,4,5,1091059200,"Works great, quite easy","We had to get this toothbrush kit for our cat who has a bad gene pool regarding his teeth.  It works just great and the cat doesn't really seem to mind having his teeth brushed at all.  After paying $300 to have them cleaned, this is definitely a good investment.  If your cat has bad teeth, or even if he doesn't, this is just a good habit to start in your cat's hygiene.  It definitely saves on the health bills later!"
393548,B003EMQGVI,A27X750TSCLBD,"Natasha Fletcher ""Earth Worm""",1,1,4,1339200000,Once you get used to it...,"I have been living a low carb lifestyle for years and never eat candy bars or sugary snacks. Also, I steer clear of artificial sweeteners and only sweeten things with KAL brand stevia so, when I saw this I was excited due to all the great reviews. Initially, I hated this chocolate, but after a couple of times I got used to the taste and now I like it.  I eat it with peanut butter or almond butter, one square does the trick for me. Very impressed!"
393829,B000E1DR2S,A1Z54EM24Y40LL,c2,3,3,5,1203206400,Great pie!,"If you're making a chocolate pie, be SURE to use this one!  Oh golly!  The chocolate is so good in this pudding that you can barely get it into the pie crust.  Drizzled with a little chocolate syrup and served with fresh strawberries on top, wow! Highly recommend!"
