Id,ProductId,UserId,ProfileName,HelpfulnessNumerator,HelpfulnessDenominator,Score,Time,Summary,Text
451704,B002F8KBDQ,A20EEWWSFMZ1PN,"bernie ""webviator""",0,0,5,1259107200,A popular product from a major movie,"Although these delicious delicacies can stand on their own merit, they have a know reputation.  Everyone remembers the red stapler from ""Offices Space"" (1999). But only a connoisseur would associate gummy bears with ""Ferris Bueller's Day Off"" (1986). While Ed Rooney (Jeffrey Jones) was making his principal getaway on a school bus, a young lady offered him a gummy bear. It was warm and chewy as she kept them in her pocket.<br /><br />You do not need to keep these animals in your pocket to enjoy them. Just be aware that they may not blend well with temporary fillings. You can just suck on them in that case."
451855,B00004CXX9,AJH6LUC1UT1ON,The Phantom of the Opera,0,0,5,946857600,FANTASTIC!,"Beetlejuice is an excellent and funny movie. Keaton is hilarious as the wacky beetlejuice. The great special effects help the film. I think this is one of the best movies ever made and I'm sure you'll agree. For a good  time, watch beetlejuice!"
451856,B00004CXX9,AIUWLEQ1ADEG5,Elizabeth Medina,0,0,5,944092800,Entertainingl Funny!,Beetlejuice is a well written movie ..... everything about it is excellent! From the acting to the special effects you will be delighted you chose to view this movie.
451919,B00004CXX9,AWYVLQIHRR8BV,"Jonathan Boyle ""bonjoyle""",1,8,3,1257638400,Beetlejuice DVD,"Let me start by saying that the DVD arrived in the condition indicated and at a good price.  However, the shipping seemed to take a lot longer than I would've expected.  Although it arrived within the ""receive by"" window, the time span they indicated was a two-week period--hardly precise info.  I'm not sure why it took so long."
451920,B00004CXX9,A9BBOAJA47WVX,Kim,0,8,1,1325548800,Beatle juice,The Beatle juice DVD I purchase did not work. We were not able to watch the movie on Christmas day as planned. I currently still have the movie. Not sure what to do with it??
451921,B00004CXX9,A1NI1XTTGBN8SH,"Peter Yurowitz ""Amazon trekker""",0,8,5,1238112000,"Great movie, great delivery","When Amazon sells something directly, you get it on time if not earlier. I originally placed the order with one of their advertised Marketplace vendors who advertised 3-4 days. the order acknowledgement indicated devlivery within 3 weeks (via USPS). I immediately cancelled that order and ordered from Amazon. Got it in 3 days."
451922,B00004CXX9,A3FVFR9MON51PW,lm3554,2,13,2,1309392000,PG? Not!,"I loved this movie as a kid, but now ordering it for my 9 year old, I was shocked to watch it again and hear not only several profane words, but the ""f"" bomb, as well as many sexual references. I think they were a bit lax in their rating system back then-- definately more of a PG-13."
451923,B00004CXX9,ANIMV3SPDD8SH,Guy De Federicis,1,12,2,992217600,CASPER IS THE GHOST WITH THE MOST,"Michael Keaton brings no distinguishing characteristics to the ghoul 'Beetlejuice', he merely acts bizarre, as does the script. It is often stunning cinematography but when the movie itself comes into focus, it's like finding one of Beetlejuice's snacks in your popcorn."
451924,B00004CXX9,A1OMXI4PSH263K,Julius Cano,0,14,4,1215993600,Subtitles??,"More than a review, I would like to know if this Blu Ray comes with Spanish subtitles. Thank u."
451925,B00004CXX9,A1LOACNK0QV9T4,"Becky ""Auntie B.""",3,23,1,1284422400,Not funny and especially not for young kids!!,"I did not find this movie at all entertaining. I am not a huge fan of Tim Burton but I though it might make a cute Halloween movie. Didn't do it for me. It also says the ""F"" word and that is not a word I care to listen to or allow my children to listen to in my home.  It seems that things that I found fun and entertaining in my youth are no longer fun and entertaining to me. If you are looking for a fun movie to watch as a family I would not suggest this one."
451926,B00004CXX9,A31V5BH5YHG4TZ,Kenny Loggins (not the singer),1,19,2,1126137600,Not very good,"Debbie Lee Wesserman claims that ""the casting for this movie is perfect, with only Alec Baldwin's performance less than memorable"". This is of course nonsense - the casting was an unmitigated disaster with the sole exception of Alec Baldwin who manages to salvage a second star for the film with a particularly memorable performance."
451927,B00004CXX9,AWG2O9C42XW5G,"David A. Smith ""Happy Halloween2012""",1,23,5,1214092800,wickedly funny,I know this version of beetle juice has not been realesed yet but still it is the movie. this movie is based on the hit cartoon show. michael keaton portrays bettlejuice in the right manner. this movie is one for the whole family. it's a must see
452293,B000I2T9CA,A1Z54EM24Y40LL,c2,0,0,3,1249430400,Not the house favorite...,"These florentines are not the house favorite, for some reason.  They love the souffles' and basically, most of the rest of them but these florentines, well, I can put them in the mix about once a month and that's all they'll eat them.  Don't know why - they like most of the other Fancy Feast varieties.  I think maybe they may be a little too upper class for my Persians!  I do recommend them though because of their high nutritional value and more natural contents."
452687,B003D4MYLS,A1Z54EM24Y40LL,c2,1,1,5,1299369600,Incredible Chocolate tea!  Hershey's anyone?,"I tell everyone I know to buy this tea.  It's the ONLY chocolate tea I've found that actually tastes like chocolate!  It's not overwhelming and although I'm not normally a fan of hazelnut, it really only serves to act as a flavor enhancer to the chocolate.  It's just awesome, hands down, not weak either, although it is decaf.  The price here is a bit high - you can get this in the store that begins and ends with a t here in the States for about two dollars and a quarter for the 18 bag size.  Great, incredible stuff, I'm almost out again!  Highly, highly recommend!"
453108,B0029XLH4Y,A1BJHZE41QWBX6,"Sharon Pipke ""Sharon""",0,0,5,1349568000,Coffee People Jet Fuel Dark Roast K-Cup Portion Pack for Keurig Brewers (Pack of 50),I received the K-cup coffee on time. I only drink this coffee in the morning to wake me up. The love the flavor of this coffee.
453547,B005GNXIYQ,A1Z54EM24Y40LL,c2,3,3,5,1325462400,"AWESOME, even if you don't like flavored coffee!","One of the largest surprises of this coffee is that those people who HATE flavored coffee go crazy over this one.  The coffee is very smooth, never tart or burnt, and is outstandingly like hot chocolate if you mix in enough half-and-half and sugar.  My husband grabbed this bag when he saw it in the cabinet and well, he just never gave it back!  All from the man who hates those ""foo-foo"" coffees I like to drink.  Every person who's tried this, particularly the ones who hate flavored coffee, just love this stuff and, since chocolate is what Godiva does best, WHO else to make this?  Great, great, great stuff, the HIT of every gathering, HIGHLY, HIGHLY, HIGHLY recommend!"
453796,B001GVIRCU,A20EEWWSFMZ1PN,"bernie ""webviator""",0,0,5,1350691200,I am addicted to this animal,When I was working for AAFES I came across this in the Base Exchange. Later I joined the reserves and lived on this stuff. I had withdrawal symptoms when my reserve time came to an end.<br /><br />There is just no substitution.  It does not taste burnt like Starbucks.  The vacuum pack seems to last forever. When you open the pack you have to restrain you self from sniffing it up your nose. I keep the open pack in the frig; not like I have to as the family plows through a pack a week. For store bought coffee this rivals some of the more exotic sourced coffee.
456360,B000G7TBKM,A1Z54EM24Y40LL,c2,0,0,5,1249257600,The best!,"As a rule, Snyder's just makes the best pretzels, hands down.  They've been making them for 100 years now and well, there's a reason they're still in business!  These are great - they disappear rather quickly.  My only complaint is that they're small and very hard so they scrape the roof of your mouth.  Other than that, they're the best tasting things out there.  Highly recommend!"
456995,B0001FZG5I,A1Z54EM24Y40LL,c2,1,1,3,1115596800,Not my cat's favorite..,"I had to take all these back to the store after I purchased them for my cat. He just hated it and wouldn't touch it. I think the cuts got stuck in his teeth too much and they were just tougher for him to chew. He prefers the sliced variety much more so than this filet version. He just won't eat these filets so it's definitely the sliced in our house. He loves turkey but just wouldn't touch this stuff. It seems as if the sliced version is easier for a cat to chew since they are more tender than these filets, so I'm sure that's probably the reason. Maybe try one of these first before buying a bunch like I did just to see what your cat likes.  They looked and smelled more like people food so I thought they'd be a ""go"" but apparently not!"
458297,B0001FZG5S,A1Z54EM24Y40LL,c2,0,0,3,1090972800,Not my cat's favorite,"This variety seems to be more shredded when you open the can - sorta like Shredded Wheat cereal in appearance.  Because of that, I think it's getting stuck in my cat's teeth whenever he tries to eat it because he's always using his paw to try to get the food out of his teeth.  He won't eat this anymore at all - he figures out what it is and that's it.  It's a great idea, but it seems to fray and get stuck in his teeth.  He gets a little aggravated over it so I took all of them back to the store."
459730,B002CJASQ8,A1Z54EM24Y40LL,c2,3,6,3,1268611200,Not TOO bad....,"Burly cat loves these shredded varieties but when you mix two flavors, well, we're not too sure about that.  He loves both the shredded chicken and shredded salmon by themselves but this one, well, we'll eat it if that's all there is left.  Again, not overjoyed with this one but we'll choke it down if necessary.  I'd suggest keeping them separate - I've never had a cat yet that was wildly in love with this variety."
460965,B000FPGYS2,A1IOSSMG1CLUCB,"Barbara  Murray ""grandma""",0,0,5,1284163200,Gerber Graduates Spagetti Rings in Meat Sauce,My granddaughter is a very picky eater but loves this product.  Put it in the microwave and its ready in just a few minutes and doesn't need to be refrigerated.  It's great when traveling.  Highly recommend.
461242,B006VRTQW4,A1BJHZE41QWBX6,"Sharon Pipke ""Sharon""",0,0,5,1349568000,Tully's House Blend K-Cup packs for Keurig Brewers (Pack of 50),I received the Tully's house blend K-cups on time. I love the flavor of the coffee. I use the Keurig coffee machine when I only want one cup of coffee. I will reorder when I'm out of the coffee.
461301,B000084EJT,A1Z54EM24Y40LL,c2,0,0,4,1090972800,Pretty good stuff!,"This one slipped from my cat's favorite, to being almost out of the picture.  He eats it still, but wants the carved varieties more.  I buy this so much that I think he can smell it through the can when I bring it home.  It's a great food - the pieces are just the right size and not too big for my cat's unusually small mouth.  Friskies makes a great food according to my cat!"
462080,B000084EJR,A1Z54EM24Y40LL,c2,1,1,4,1090972800,Great ground food!,"Each cat I've had really likes this variety.  They prefer the sliced versions over the ground such as this, but if I buy ground, they only like this one.  It smells pretty normal - not too stinky to make you faint, but it seems more appealing than most cat foods do.  I get pretty positive results with this variety and a lot of purring!"
463588,B004QDA8WC,ALEABNMSVO1JI,gibble,0,0,5,1350172800,Comfort in a cup,"This Chai Latte is a ""go to"" when you want a little something sweet or just to relax and enjoy the moment.  Great product that is always on the mark."
463866,B002CJAQ56,A1Z54EM24Y40LL,c2,3,4,4,1269043200,We'll eat it ONCE in awhile....,"This is one of those flavors that you keep around just for the extra ""surprise"" to get through using the same old food.  It isn't her favorite, but she does like it once in awhile for a change. Not sure what Poultry Platter means, but I can just about guess. Anyway, it smells fresh, doesn't stink ridiculously, and it's palatable.  Recommend."
466641,B000G6O2QG,A32NC2UF34RJQY,D. Pagliassotti,0,0,5,1351209600,Great for HS lunch,"Great for HS lunch, kid enjoy as a snack also, will buy again. Salted chips are good too, tried them too."
466716,B001EQ55PE,A1Z54EM24Y40LL,c2,1,1,5,1343606400,"Incredibly fresh, flavorful coffee!","This coffee has been around for so long, that I've lost track of when it was first produced.  Originally a product of the old A&P grocery stores, it has LONG had a reputation of just very amazing coffee at a very reasonable price.  I am SO very glad that I found it again at our local Kroger store, and since they kept selling out of it, all of the other grocery stores around here decided to stock it as well.  Even the variety store that begins and ends with a t.<br /><br />All that to say that we buy this whole bean exclusively, grind it by the pot every morning, and just sit back and enjoy that incredible aroma and flavor that we have for most of our lives.  Our parents, our grandparents, and their parents all enjoyed this coffee.  It's a very long family tradition, one that I certainly won't be breaking anytime soon.  Just an amazing cup of coffee, EVERY time.  Highly, highly, highly recommend!"
468126,B0012KB46Q,A1Z54EM24Y40LL,c2,1,1,4,1249171200,Loved in this house!,"When my cat gets tired of the gourmt Fancy Feast Chicken, I put this one in the mix and she loves it!  As a rule, for some reason, I've never had a cat that would eat liver.  Don't know why, just don't like it I guess.  But this one was different for some reason.  When you open it, it doesn't smell overwhelmingly of liver, mostly chicken, which is probably why she likes it.  Great stuff, healthy and full of protein. Price is a little high though, don't understand that.  Highly recommend!"
468591,B003LPZSI0,A1Z54EM24Y40LL,c2,1,1,3,1342742400,"Excellent for odor, terrible for dust!","Our little dude has arthritis now and since this developed, we've had to move his litter box to the first floor of the house.  So, when I found that this stuff totally kills the odors, I grabbed a box since Tidy Cats had begun to fail in the odor task immensely.  Quite honestly, I've NEVER had a litter that completely, totally, without a trace, ridded the air of all kitty odors.  This stuff, hands down, is the BEST I've ever tried.  There's absolutely NO odor whatsoever!  It's just a bit weird how you just do not smell anythiing at all.  However, don't have your cat sitting there waiting while you're filling the box.  As good as this is at clumping, odor control, and great smell, it's TERRIBLE for dust!  It just blows all over the place and I actually have to turn on the fan in the bathroom to get rid of it.  Why they can't get this without the dust by now is beyond me.  But, if you live in a small space and need the odor control, this is your litter.  Just get out the Swiffer and be prepared to dust.  Recommend highly, but with the above condition."
469315,B001E5E24A,A3LF9GB062XMF6,TheLlamaBook,4,5,5,1276992000,ridiculous energy,"The coffee itself doesn't taste amazing. It's tolerable. Perhaps it's on par with lower-end medium quality espresso.<br /><br />The coffee high that I get from this is insane. It is better than most energy drinks that I've had. Energy drinks really just get me shaky and on-edge. This gets me close enough to on-edge that I have comfortable control over myself. It is like speed.<br /><br />I love it.<br /><br />Good job, Medaglia!"
469335,B001E5E24A,AXLWYATME4LVK,S. Wild,0,0,5,1286409600,Awesome easy Espresso!,I love the taste of the Medaglia D' Oro Instant Espresso. I use it to make a latte every morning! It is $5. a jar in the local store here and only one store carries them. It is SOOOO much cheaper here!
470631,B002CJG182,A1Z54EM24Y40LL,c2,1,1,4,1270771200,"It's okay, but a little chewy","I used to buy this for my meat and potatoes male Persian, until his teeth went haywire. After having most of his teeth removed, he can no longer chew these hunks of meat, which are at least 1/2 inch long in some cases.  They're great on flavor, contain a lot of rich gravy, but if your cat cannot chew, there's no way they can manage with this one unless they swallow it whole. I have to resort to the shreds, which he LOVES, but he liked these for a change once in awhile.  I heat them up too before serving them since the older cats get, they can sometimes lose their sense of smell. Works like a charm if yours isn't eating.  Recommend based on past experience, but the are other varieties that appear to be more tasty for the cats.  Particularly their shreds."
477373,B000SV5DKS,A1Z54EM24Y40LL,c2,10,10,5,1199577600,"Great snack, convenience","Love fig newtons!  These are really fresh individually sealed, unlike their 1lb counterpart packages that have a tendency to get stale rather quickly.  These are worth the extra cost for that reason alone.  But, they're grab and go snacks too that are somewhat healthy for you than a regular cookie.  They also make great treats for after ballgames and other sports.  We love these in our house, highly recommend!"
477951,B0012KCUPU,A1Z54EM24Y40LL,c2,1,1,5,1249344000,"Review about the actual food, not the service","When you open this can of food for your cat,  you'll notice right away that it's packed with fish.  My cat gobbled this up right away - the protein level is high, the flavor must be right on.  The odor isn't bad as it is with most tuna products - you don't really smell it at all, which I found to be surprising.  Great food but the price here is about $6 more than what I pay for it at the grocery store.  Highly recommend!"
478196,B000MIFS5M,A1Z54EM24Y40LL,c2,1,1,4,1203292800,"Great stuff, fast lunch!","If you're like me and get tired of packing lunches, be sure to grab these! They just make it SO much easier and it's easier for the person who's eating the lunch as well.  They taste great too - I like this one better than the regular canned version.  It's healthier too!  I buy these things by the ton it seems like! Highly recommend!"
479718,B000BXXBQG,A1Z54EM24Y40LL,c2,1,1,5,1219795200,Great item!,"If your cat(s) are like mine and like a variety each day, then this pack is the ticket.  I spend WAY too much time in the pet food aisles selecting the correct amounts of each kind so just buying these cubes makes life tons easier.  I would suggest, however, that you look around for a better price.  This is pretty high, I paid about seven dollars less at a local nationa store beginning and ending with a t.  Cats are happy and so am I!  Highly recommend!"
480169,B007GOCR5E,A1Z54EM24Y40LL,c2,2,2,5,1339372800,One of the boys' favorites,"I always have Powerade in the house - for everything from the flu to overly hot baseball games, it's always been Powerade to the rescue.  The vitamins and electrolytes in this product really bring a person back together - you can even feel the hydration when you drink this stuff!  Plus, if you give this to a child after a bout with the flu, it really helps them get back on their feet a TON faster!  I put water in it for flu treatment, and ice cubes for baseball games.  This is the boys' favorite flavor - it's a bit like cherry mixed with lime, I guess is the best way to describe it.  And, it's best very, very cold.  Fabulous product, been buying it for years.  Highly HIGHLY recommend!"
480703,B00719WZNS,A27X750TSCLBD,"Natasha Fletcher ""Earth Worm""",1,1,5,1339200000,Favorite Zevia,"I love this flavor, I was very happy when I got this soda I have tried every flavor and this is my new favorite now. Very pleased with the taste, very refreshing !"
480728,B001G0NKYQ,A1Z54EM24Y40LL,c2,0,0,2,1304467200,Buy with caution...,"This one is just bad, very, very bad according to my TWO Persians!  One jumped away, came back and actually pawed my leg he was so upset over it and the female, well, she could smell it from a distance and wouldn't even approach the bowl!  Good ole' Ollie the neighborhood oppossum had quite the feast that night with these two cans of expensive cat food!  This variety has chunks of meat, kinda like squares actually, mixed in with a thick gravy.  I'm surprised that my male passed it up but since they both gave it the ""paws down"" response, it must be something in the mix.  Cannot recomend this one - try one of the others first."
481236,B0047CKHO6,AXLWYATME4LVK,S. Wild,0,0,5,1302480000,Another great product,Loved being able to get a variety pack. Price very good. Couldn't get the variety pack for that price around here. My Grandson enjoyed these and I enjoyed knowing I was giving him a food that was good for him.
485076,B002CJG1YQ,A1Z54EM24Y40LL,c2,3,6,3,1268611200,Not TOO bad....,"Burly cat loves these shredded varieties but when you mix two flavors, well, we're not too sure about that.  He loves both the shredded chicken and shredded salmon by themselves but this one, well, we'll eat it if that's all there is left.  Again, not overjoyed with this one but we'll choke it down if necessary.  I'd suggest keeping them separate - I've never had a cat yet that was wildly in love with this variety."
487464,B002G0CA6O,A27X750TSCLBD,"Natasha Fletcher ""Earth Worm""",0,0,5,1239062400,So tasty,"I just got this flavor today, and it is so delicious!!!! I love it...if you want a good for you great tasting soda try it!<br /><br />Thank You Zevia"
489467,B002ZJ3CC2,A20EEWWSFMZ1PN,"bernie ""webviator""",2,3,5,1286064000,My new favorite snack,"Who would have guessed that this combination would work, taste so good and satisfying?<br /><br />The concept is so simple. We have been eating all kinds of chocolate impregnated with almonds. Why not the other way around.<br /><br />The size of the packed is not only good for calorie counters but also from a snack stand points its self. Being in individual packages, helps keep and ration it through the workweek.<br /><br />I did try sucking on them and that just does not work as it is the combination that fives the sweetness and fullness to the snack."
489825,B001HN5S38,A1VWS6CYSXHN2K,M. Chan,0,0,5,1309996800,"Good buy, Great price!","I use this organic sunflower seeds in my weekly bread routine. The quality is great compared those you pay premium in WF and some-expensive-gourmet-markets, and I only paid a fraction of the premium price. I surely will order again!"
490568,B000CQE3IC,AQXR5XB3URGK9,"R. A. McDowell ""WWSista""",1,1,5,1308009600,"If you like Slim Jims and/or Tabasco, then these babies are fantastic. Hot, but delicious. A+!!!","This review is in reference to the 18 count pack of Tabasco flavored Monster Slim Jim's, although any size of the Tabasco Slim Jims are GREAT. (<a href=""http://www.amazon.com/gp/product/B000CQE3HS"">Slim Jim Giant Smoked Snacks, Tabasco, 0.97-Ounce Sticks (Pack of 24)</a>)<br /><br />  I love Tabasco sauce, and love the amazing synergy products they have made with other companies. So when I saw Tabasco Slim Jims, being a fan of Slim Jims anyway, I had to try them. The smaller sized ones, which I have been unable to find here on Amazon, taste great, but they are somewhat tougher than the larger versions, though not in a bad way. The medium sized and large ones, which this review is about, are much softer. Regardless, they are ALL delicious. They have the same spicy flavor that we Tabasco lovers have come to crave, but at the same time, since it was mixed in with other ingredients, it isn't so hot that you are forced to stop eating no matter how good it tastes. My friends and I all agree that it does have a high heat factor to it, and people who don't like spicy stuff might find it too much. But if you like spicy foods, these are an AMAZING snack. If you haven't tried them, then I highly recommend you get one from your grocery or convenient store. If you like them, buy them here since they are cheaper in bulk. Fans of Tabasco will not be disappointed. That's my $.02 on the matter folks.<br /><br />  Thanks you so much for your time folks.<br />  Sincerely, R.A. McDowell"
490885,B004DN7MI8,A1BJHZE41QWBX6,"Sharon Pipke ""Sharon""",0,0,5,1349568000,Tully's House Blend K-Cup packs for Keurig Brewers (Pack of 50),I received the Tully's house blend K-cups on time. I love the flavor of the coffee. I use the Keurig coffee machine when I only want one cup of coffee. I will reorder when I'm out of the coffee.
491840,B004IN8YQM,A1Z54EM24Y40LL,c2,0,0,5,1335398400,Loved in this house!,"I thought this was another strange creation - cheese and fish in the same cat food can.  So, I only bought 2 initially, just as a trial because, quite frankly, I thought it sounded a bit gross.  Not so!  Again, Garfield strikes again and this disappeared faster than the sardines version!  I now buy this on a regular basis and the Persian king couldn't be happier (unless, of course, he had it attached to him via an IV).  Great product, doesn't reek of odor upon opening, but a bit pricey here. Check out your local store first. Highly recommend!"
