Id,ProductId,UserId,ProfileName,HelpfulnessNumerator,HelpfulnessDenominator,Score,Time,Summary,Text
144,B001GVISJW,A1Z54EM24Y40LL,c2,0,0,5,1269129600,Great for the kids!,"If you are looking for a less messy version of licorice for the children, then be sure to try these!  They're soft, easy to chew, and they don't get your hands all sticky and gross in the car, in the summer, at the beach, etc. We love all the flavos and sometimes mix these in with the chocolate to have a very nice snack! Great item, great price too, highly recommend!"
2564,B000ED9LDU,A1VWS6CYSXHN2K,M. Chan,0,0,5,1309996800,A must have for healthy life,"It's also a routine baking ingredient. I put it into my bread along with sunflower seeds and organic wheat flour. I also put it into my smoothie, stir fry dishes....anything you can think of! Good price and really, it's a must have for a healthy diet!"
3205,B005K4Q1VI,A1BJHZE41QWBX6,"Sharon Pipke ""Sharon""",0,0,5,1349568000,"Grove Square Hot Cocoa Cups, Milk Chocolate, Single Serve cup for Keurig K-cup brewers, 24 Count","I received the K-cups on time and in execellant condition. I usually drink coffee, but at night the Hot cocoa is good with a snack, just before bed."
3588,B004X8TK9W,A1Z54EM24Y40LL,c2,1,1,5,1338249600,AWESOME!,"I may be dating myself here a bit but I remember when the first Soft Batch cookies came out.  These were the first and they were bigger and yes, even softer than these are now.  But, at that time, they were the ONLY soft, prepackaged cookie (can you believe that?) besides Archway.  They then came out with at least a dozen other varieties but for some reason, they stopped making them.  I can remember every kid imaginable going nuts over these things so I'm wondering why they stopped.<br /><br />Anyway, back to today, these cookies, even though they're smaller, are still quite excellent.  They are just so soft and taste better than Keebler's other soft and chewy cookies.  This package made it about 20 minutes in this house - that's what happens when you're raising a bunch of Titan boys!<br /><br />Great, great stuff, HIGHLY recommend!"
4994,B000FA398U,A1Z54EM24Y40LL,c2,3,3,5,1203206400,Best for oyster soup!,"Try these first for all your seafood soups and stews.  They're just amazing. The flavor enhances all your seafood and just makes it wonderful.  Plus, these are great just to snack on out of the bag.  Kids love them!  We use them for chilis, soups, and recipes as well.  Highly recommend!"
6372,B000084EKO,A1Z54EM24Y40LL,c2,0,0,3,1090800000,Not any different than regular Friskies,"I honestly cannot say that I saw any difference whatsoever in this variety compared to Friskies regular sliced beef version.  Actually, my cat preferred the regular Friskies over this one.  He's not really all that jazzed over these Fancy Feast varieties anyway, so if you're going to buy this one or the chicken, save your money and buy the regular Friskies versions.  They seem to taste better to the cat and it saves you money.  I've never had a cat that ever got too thrilled over this variety over the years so I guess I'll get the special ones instead."
6373,B000084EKA,A1Z54EM24Y40LL,c2,0,0,4,1090972800,Not their best...,"I think 9 Lives does a better job on this variety than Friskies.  Or I should say my cat does.  Friskies doesn't look as fresh or as appetizing as 9 Lives, and my cat doesn't like it as well.  It just smells nasty and looks not quite as good as the 9 Lives.  I think they could definitely do better on this variety -maybe even add cheese to it!  My cat leaves this one in the dish but eats the 9 Lives version."
6374,B000084EKB,A1Z54EM24Y40LL,c2,0,0,4,1091059200,Great food!,"This version is ground.  NOt my current cat's favorite version, but he really likes the taste. I do wish they'd make this one not ground but in the pieces variety too.  My previous cat really liked this one and usually licked the bowl clean. But, neither wanted it more than once or twice a month.  Why, I don't know but it seems to be a little richer than the others."
6375,B000084EKC,A1Z54EM24Y40LL,c2,1,1,5,1090972800,Great food for all cats!,"According to my cat, this stuff is just great.  He just licks himself for hours after eating this one and just loves the taste.  He will lick the bowl clean on this one and eats it usually pretty quickly.  But, he still doesn't want it more than 2-3 times a month because it's fish - not exactly his favorite food.  It's a great diversion from his regular fare and one that he truly appreciates."
6376,B000084EKD,A1Z54EM24Y40LL,c2,1,1,2,1090972800,Needs improved,"I haven't had a cat yet that liked this one.  It's just a little too interesting for them I think.  It smells nasty but I think it's just the taste that really gets them.  My current cat just won't touch it - he might eat a couple of bites if he's REALLY hungry, but I always wind up throwing it out.  This one is ground so if your cat likes pieces, don't try this one."
6381,B000084EKG,A1Z54EM24Y40LL,c2,2,2,5,1090972800,Awesome food!,"This is my cat's favorite one.  He just licks that bowl clean whenever he gets it.  I usually buy a case of this one at a time and judging from how often it sells out, other cats must love it too.  The cheese hunks are large and look quite tasty.  It's just a very nice variety and something I'm sure every cat loves.  My previous cat about ran me down whenever I got it out to give to him and my current cat is no different.  Give this one a try - you'll be glad you did!"
6383,B000084EK8,A1Z54EM24Y40LL,c2,2,2,3,1090972800,Not the favorite in our house,"Once or twice a year for a little variety and that's about enough for my cat of this particular variety.  He likes it for a change from his chicken, turkey and beef, but not very often.  He will eat about 3/4 of the can and then he's had enough. He's not a huge fish fan anyway, but this stuff looks to be about the best out there in the fish varieties.  The chunks are bit sized so if your cat has a small mouth like mine does, it will be easier to chew.  Don't know why my cat doesn't like this type of fish, but he really could care less about it."
6386,B000084EK9,A1Z54EM24Y40LL,c2,0,0,1,1090972800,This stuff is bad!,"I honestly have to say that I just won't buy this variety. It looks bad, smells bad and I'm sure tastes bad because my cat won't touch it.  No way, no how, won't even look at it.  My other cat was the same way with this one.  It just looks like a huge ground up mess of leftovers they had at a fish market.  I'm sure some cats must like it because it's still being made, but there's other things out there much, much better than this one."
6394,B000084EK4,A1Z54EM24Y40LL,c2,0,0,3,1090972800,Great beef look,"This food variety is ground, thus my cat doesn't care that much for this variety. But, he liked the taste of it a lot so I have been buying it off and on throughout the years.  My previous cat really liked it so I've purchased quite a few of these.  It's got that liver smell to it but they like it so who cares? If your cat likes ground, give this one a try for sure."
6395,B000084EK5,A1Z54EM24Y40LL,c2,1,1,5,1090972800,Family favorite - looks like steak!,This is my cat's third favorite food.  It's great stuff - the gravy is so very thick and the food looks like bits of steak slicked off for your friend.  My cat licks the bowl clean every time and wants more.  They should send me discounts for as much of this stuff I buy.  I buy it by the case if that gives you some idea!
6396,B000084EK6,A1Z54EM24Y40LL,c2,0,0,5,1091059200,Great food!,"This is another favorite in our house.  My cat doesn't want it more than 4 times a month or so, but he still wants it and licks the bowl clean.  It is fish, not his favorite, but he really likes his salmon and this one is outstanding.  It's ground (why don't they make a sliced or bits version?), not his favorite either, but he does get it down pretty quickly.  Try this one - it's a definite winner."
6397,B000084EK7,A1Z54EM24Y40LL,c2,0,0,4,1090972800,What's in this?,"This one is a great basic food. Whatever is in it, cats really go for and mine is no exception.  My current cat really doesn't like the ground variety which is what this is.  He will eat it occasionally, so I only buy it about twice a year.  My previous cat had to have it more often and really enjoyed it.  It's hard to judge what a cat will eat so if your cat likes ground, give this one a go because it really seems to be a big favorite."
7964,B004WM0ZTS,A20EEWWSFMZ1PN,"bernie ""webviator""",4,5,5,1281830400,Take a sharp object to defend your self,"Unlike most people, I prefer not a weak coffee but a milder roast than the burnt stuff most coffee houses make that requires many accoutrements to mask like cream, sugar and artificial flavors. Therefore, I purposely only tried the Columbian.<br /><br />I work in a place that has poorly serviced coffee ""dispensing machines."" They are fun in that you never know what will come out in a day-to-day basis. Some time just your coins back. A few people have illicit electric coffee pots, others use a French press, and still others sneak out for the real thing.<br /><br />Now that I discovered the Columbian Via. I have to defend my cup from all those noses that circle my cup. I know there are directions on the pack; however, I now have my own ritual.  Clean cup, fill 2/3rds filtered water. 90 seconds in the microwave.  Shake contents to bottom of pack.  Rip the whole top off the pack with teeth.  Pour pack in coup and watch sizzle. Stir for a few seconds.  Add a tad of ice. Hope I can make it back to my desk before the cup empties.<br /><br />I was never a fan of reconstituted coffee however I think it is the addition of the micro-ground coffee that adds the edge necessary.<br /><br />In any event you owe it to yourself to try it."
8029,B0012KH06Y,A1Z54EM24Y40LL,c2,2,2,3,1249516800,Great nutrition...,"These guys are quite high on the nutritional scale but on these marinated morsels varieties, well, they hate them.  They get stuck in my cats' teeth and although it can be quite comical watching them afterwards, it just ins't worth them only eating about half a can and tossing the rest down the garbage disposal.  I recommend them for the nutritional value and please try them if you cat loves chicken.  My rescue loves many of the other varieties and this stuff has improved her quality of life tremendously. Recommend!"
8223,B000BXUVYG,A1Z54EM24Y40LL,c2,1,1,4,1222300800,"Nice treat, make sure they CHEW them!","As with most cats I've read about here, both of mine gulp these down without even the slightest tooth mark in them.  This can make them vomit so my trick is to snap them in two so then they have to chew them because of the ragged edges.  I""m used to the snapping since I have Persians (they have smaller mouths than a regular Tom does) and these aren't hard to snap at all.  They love the taste of these although I'm not all that sure they really help with the furballs.  Does anything really help though?! :)  I do recommend these because of the great taste, but try snapping them in two if your cat has trouble vomiting after gulping his/her food."
11069,B004INIUQQ,A1Z54EM24Y40LL,c2,0,0,5,1325980800,"Loved by one, hated by the other","This is a new line for Friskies and is not a ""treat"" as the title implies. Just another can of cat food to try! My female loves this stuff, can't wait to get it in her dish, and gets quite angry whenever she gets anything else but this or the tuna variety. My male, forget it!  He loves the shredded turkey and cheese but won't go near this one.  Weirdest thing in the world to me - thought he'd go gaga over it like he does his turkey, but he just won't touch this stuff.  Anyway, this is a bit pricey here so check around for a better price.  At least in Ohio it's a bit high!  Highly recommend!"
11777,B0012KB4WU,A1Z54EM24Y40LL,c2,3,3,4,1249257600,Best of the florentines,"This one seems to be flavored more to a cat's liking than the rest of the Florentine varieties.  They're expensive, so buy one of each to see what floats with your cat but here, one will eat this and the other one won't.  It is gobbled up quite quickly too, I might add, by one of them so there you go!  Anyway, the greens addition is great for cats, they seem to like it in their other varieties, and they're high on the nutrition scale. So, if you're looking for higher protein and better nutrition all around, be sure to give these a go.  In our house, the pates have fared the best over the shreds and particularly, these florentines.  The egg soufles seem to be the favorites here - they ""hoover"" them down so fast they barely come up for air!  Recommend!"
12667,B000FKL0EU,A20EEWWSFMZ1PN,"bernie ""webviator""",1,2,5,1329350400,Wintergreen is my favorite flavor,"Called ""Frozen Tongue"" this was the second flavored released by ALTOIDS in 1998.<br /><br />ALTOIDS mints were first produced in England at the turn of the 19th century during the reign of King George III.<br /><br />Ingredients: sugar, artificial flavor, gum Arabic, gelatin, corn syrup, natural flavor.<br /><br />My first encounter with wintergreen was in a heat rub (I smelled it but did not eat it.) Then I found it in some circular candy with a hole in the middle. Now I keep a tin of ALTOIDS at work, home and in the car."
13293,B003H26J5I,A27X750TSCLBD,"Natasha Fletcher ""Earth Worm""",2,2,5,1320105600,YUMMY if you can cook,"I LOVE these noodles.  You HAVE to cook them right, drain and rinse or they WON'T be tasty.  I drain them and rinse until very little scent of soy is left then add to HOT pan with a little coconut oil. I add garlic, onion, red pepper flakes and a little salt and cook for a while then i eat em like ramen with a slice of cheese .  Very good diet food."
15854,B007TJGZ5E,A1BJHZE41QWBX6,"Sharon Pipke ""Sharon""",0,0,5,1349568000,"Green Mountain Coffee, Nantucket Blend K-Cup Portion Pack for Keurig Brewers, 50 count",I received the order in time. I love the flavor of this coffee and I can only make one cup of coffee at a time so I have a fresh cup of coffee all the time.
16442,B007TJGZ54,A1Z54EM24Y40LL,c2,0,0,4,1350345600,"Not the best, but CERTAINLY, not the worst!","This is a breakfast blend coffee and, for many coffee producers, a breakfast blend also means ""the strongest daggone brew we can make"" mentality.  Well, caffeine is caffeine and this guy is a bit strong for me.  I prefer Caribou's breakfast blend over this Green Mountain version. It's just entirely more smooth, no bitterness at all, and just a very enjoyable cup of coffee.  I think this one tastes a bit burnt, like Starbuck's, not at all as nice as some of their other blends (especially the pumpkin spice - awesome!).  Try it to see if it suits your taste but get the 12-pack first.  Otherwise, if you think the way I do, 24 of these guys is a LOT of coffee to wash down!"
16443,B007TJGZ54,A1KPKQZ1GMKAKO,Norma,0,0,5,1350345600,Great Coffee,"When I bought my coffeemaker, tried out several different brands and types of coffee but this one has become a stable.  I can count on it for a great cup of coffee - not too strong or too mild, just the way I like it.  Unfortuantely, I now drink more coffee than I probably should because of the taste but that's the only downside."
16444,B007TJGZ54,ALEABNMSVO1JI,gibble,0,0,5,1350172800,awesome coffee,"I have enjoyed this brand of coffee for several years now and it has been consistent in flavor!  I was happy to see that it came in a 50-count box....with cold weather approaching, I will be drinking a LOT more coffee."
16445,B007TJGZ54,A2AAA0U5QD5TGB,DVDLOVER,0,0,5,1350086400,Great buy for K-Cups,"If you love your Keurig coffee brewer, you'll love this buy for Green Mountain 50-count Breakfast Blend Coffee K-Cups. GREAT!!!"
16446,B007TJGZ54,A2WK0Q0WABVVH,bowtie55,0,0,3,1350086400,not to crazy,"Love green mountain coffee, but the breakfast blend was not strong or bold enough for me, will try stronger and bolder ones and get back to you all with another review, thanks"
16447,B007TJGZ54,A1N58XGILUVX6S,Martin B. Kerschus,0,0,3,1350000000,Too weak,I expected a little more flavor as I usually like Green Mountain Coffees.<br />Next time I'll look for a French Roast!
16448,B007TJGZ54,A1B3SY3J47EXZE,Terry Defosse,0,0,5,1349827200,50 count Green Mountain Breakfast Blend K-Cups,"I recently purchased the 50 count Green Mountain Breakfast Blend and I have to say that the price was unbeatable, Not to mention the coffee. I only drink Green Mountain Coffee. I only wish they could offer more variety in the 50 count. I will and am going to continue buying this brand of coffee.Love it- Love it- Love it<br /><br />  Thank You Green Mountain Coffee"
16449,B007TJGZ54,A2SNPFTCYI60V2,D. Bright,0,0,2,1349827200,Not my favorite coffee.,"Seems very weak.  I must be honest, I ordered the wrong coffee.  I was sad. This isn't bad as a base for an iced coffee."
16450,B007TJGZ54,AN71KYKFED796,Lesley V.,0,0,5,1349740800,Green Mountain coffee,Such a great product! Delivered fast & fresh. Can always rely in Green Mountain & kcups are great for people on the go & want 1 cup.
16451,B007TJGZ54,A1BJHZE41QWBX6,"Sharon Pipke ""Sharon""",0,0,5,1349568000,"Green mountain Coffee, Breastfast Blend K-cup Portion Pack for Keurig Brewers, 50 Ct.","I received the order in time. I love the blend of coffee, I use the Keurig machine every day.This is a decafe coffee, I also use regular blend."
18758,B001534R00,A2C2I3VM7FT4PQ,barby153,3,3,5,1284249600,Love the flavor!,"This is my pre-workout, afternoon pick me up every day drink, love it!  Dont' know about burning any actual calories but it's a great energy drink with no jitters."
19063,B001FA1EZ4,A1Z54EM24Y40LL,c2,2,2,5,1269129600,Super yum!,"I just love Hershey's chocolate anyway, so it's pretty hard for them to totally muck up something enough to have me dislike it.  These guys are just awesome!  I love almonds and well, they're supposed to be pretty healthy and when combined with chocolate, well, what an excuse to eat healthy! They do provide a bit of protein so if you're starving, they help somewhat to alleviate that.  They're just awesome on their own - highly recommend!"
19966,B001G0NKVO,A1Z54EM24Y40LL,c2,3,3,5,1304467200,Great starter for this variety,"In case you're wondering, this is a pate, and not the hunk variety.  That said, I have one cat that will eat this and one that will not.  I've never had a male that will eat a pate, no matter what the variety and this one is no exception.  The female, she just lOVES this stuff.  I mix it with a bit of water and microwave it for about 8 seconds since it's pretty thick in the can. The quality is quite good on this stuff too - almost like Fancy Feast.  It's a bit rich and will fill you cat up quite nicely too.  Great stuff, loved sincerely in this house, highly recommend!"
22609,B002CJAOTY,A1Z54EM24Y40LL,c2,0,0,5,1338249600,"Great food, very meaty smelling and appetizing","My salmon loving Persian thinks this is her second favorite so I've bought enough of this stuff to own the company! She goes made for it and always cleans the bowl whenever it is served. Great stuff, but if you're looking for a higher protein content like I'm usually doing for this little girl, then go with the Fancy Feast version of this. It's almost double the protein and if you're working on a rescue cat, then that will make all the difference in the recovery process. I've sat on the floor for many hours hand-feeding wet cat food to this cat to encourage her to eat and this one, is her second favorite! But, check the price locally. I can get this down to about thirty-three cents a can when it's on sale and with a coupon. Pretty high here. Highly recommend!"
23078,B004ZIER34,A1Z54EM24Y40LL,c2,0,0,4,1312502400,"LOVE the low acid, quite strong, however","Overall, if you're looking for a low-acid, ""he-man"" coffee, then be SURE to grab this!  It's quite amazing the difference this low acid coffee can make to your stomach and I could even drink the entire pot of the stuff! Normally, I take coffee completely black, no additives whatsoever.  But, with this french roast, it's quite strong.  REALLY strong and definitely, less is better in the pot. If you're a fan of Starbuck's Verona coffee and have no trouble drinking that stuff black, this is your best bet for a low acid coffee.  Combined with cream and sugar, then no problem.<br /><br />I tried this coffee just wondering if I could really tell the difference between regular and low acid coffee.  There IS a difference! The flavor is quite good but doesn't end smoothly like oh, say, Folger's might, but this is a gourmet coffee and will carry a stronger punch than a commercial coffee like Folger's will.  I plan on trying a different roast too since my tastes are more towards a full-bodied coffee instead of the kind that tastes like it was made in Texas during the Wild West days!  This ends a bit rough, kinda like the Starbuck's Verona, not as smoothly as I would prefer.  I made it with bottled water, not tap, to get the full flavor and aroma, so keep that in mind when deciding on which flavor to choose.  I am going to continue to play with this flavor to see if I can get it to suit my tastes better.  If you try it and it's too strong, then I suggest you dump the pot onto your roses!  Makes them quite gorgeous, actually!<br /><br />This is a great product, particularly if you're looking for the low acid variety.  I sincerely doubt you'll find a better low-acid coffee out there.  But, if you're like me and prefer a more smooth, well-rounded roast, then I suggest you try one of the other roasts.  Great product, highly recommend!"
24369,B007OADN6C,A1Z54EM24Y40LL,c2,0,0,5,1338076800,Completely awesome!,"If you happen to have someone in your house that isn't overly wowed over an entire chocolate cookie, but just wants a taste, grab these!  I buy both these and the chocolate variety and they're loved as much as the chocolate.  It's just nice to have that difference when you're ""chocolated out"" at Christmas, and just want something a bit lighter, particularly in the summer.  The boys in this house love them as much as the chocolate ones and actually, prefer them most of the time.  The chocolate creme centers in this version is the same as the regular Oreo, just not overly rich.<br /><br />Great, great product, been waiting for YEARS for these to come out.  Highly recommend!"
24769,B000634IC2,A1Z54EM24Y40LL,c2,1,2,3,1222300800,"Not bad, if you can stand the smell!","I grabbed a bag of this when it went on sale at the local market and, although one of my cats really likes it, I can't stand the smell!  Honestly, it smells like horse doo.  Whenever she jumps in my lap after eating this stuff, it about makes me gag!  It has to be the strangest smelling cat food I've ever used, which is why I wanted to write this review.  Just thought it was rather strange. I don't plan on buying it again because of that - the smell is Blech!  It isn't her favorite food, but it's tolerable, especially if mixed with a little meat.  The protein content isn't as high, only 30% because it's for the indoor cat.  I would recommend it for that reason because it does help with the weight factor. Just be careful,your nose will have to be made of steel to get past the smell!"
32234,B000MICPSA,A1Z54EM24Y40LL,c2,1,2,5,1203465600,Great stuff!,"If you need fast food, fairly decent food, then grab these by all means! They are absolutely great in a pinch and taste even better with a dab of butter melted on top.  Kids can toss these in the microwave and have a fairly decent lunch.  They taste great, hubbies love them too, although they probably need two to fill them up, along with a sandwich, and they're a decent value.  Recommend!"
33306,B000G7P50M,A1Z54EM24Y40LL,c2,0,1,3,1249257600,"Love the taste, but they break off your teeth!","That said, they are the best tasting things around so if you love a hard, cruchy pretzel, this is your brand!  They just taste superb but they really play havoc on my teeth so I really cannot eat them.  Or, just soak them in a glass of Coke like the children do and well, you get two treats in one!  Highly recommend!"
33536,B006N3I84I,A1BJHZE41QWBX6,"Sharon Pipke ""Sharon""",0,0,5,1349568000,Tully's Italian Roast K-Cup packs for Keurig Brewers (Pack of 50),I received this order on time. I was late in getting this review out. I drank all the coffee already. I love the favor of the coffee.
35654,B0012KH0CS,A1Z54EM24Y40LL,c2,3,3,5,1249171200,Awesome flavor!,"If you have Persians, you know how fussy they can be about their food.  Which is probably why they use one to advertise this food! :) Anyway, believe it on this flavor.  When you open the can, it just smells like fresh fish.  Honestly, can't say I've ever smelled a cat food that smelled like people food, but this one certainly does!  My cat goes mad for it -she just cannot get it in her mouth fast enough.  It's quite comical watching her eat it too - it is almost like she turns into a Hoover vacuum and well, it's gone in a flash!  The price here is about eighteen cents a can higher than what I pay for it but for this flavor, I would consider it!  Highly recommend!"
